{
  "$schema": "http://json-schema.org/draft-07/schema#",
  "$id": "https://vexa.ai/spec/values-proven.schema.json",
  "title": "values_proven v1 - the compiled currency",
  "description": "The compiled answer to a contract's `required_values[]`: one row per value id the candidate claims to have proven, and the evidence backing the claim. Rows are STATION CLAIMS, not a verifier's own findings - a downstream verifier checks that the claim exists, names a station, carries evidence, and that any subject_digest it cites is genuinely one of this entry's images. It cannot re-run a station. THIS FILE IS THE ADDRESSABLE DEFINITION; `channel-entry.schema.json` embeds the same shape inline, because that is the copy the in-cluster verifier enforces against a signed entry. The two are held identical by `publisher/tests/test_value_chain.py::EmbeddedValuesProven`, which resolves the embedded $refs and compares - a drift between them is a finding, not a variant.",
  "type": "array",
  "items": {
    "type": "object",
    "additionalProperties": false,
    "required": ["id", "verdict", "station"],
    "properties": {
      "id": {
        "type": "string",
        "minLength": 1,
        "description": "The contract's `required_values[].id` this row answers (e.g. V-est-1). Matched by exact string, so a typo is a missing proof, not a silent pass."
      },
      "verdict": {
        "enum": ["proven", "waived"],
        "description": "`proven` - a station ran something and the evidence rows say what. `waived` - a NAMED HUMAN accepted the value unproven for this entry; `waived_by` is then mandatory, because an anonymous waiver is indistinguishable from an omission."
      },
      "evidence": {
        "type": "array",
        "description": "What was actually done. Mandatory and non-empty on a `proven` row: a proven verdict with no evidence is the exact shape of the void this block exists to close.",
        "items": {
          "type": "object",
          "additionalProperties": false,
          "required": ["what", "ref", "tested_at"],
          "properties": {
            "what": {
              "type": "string",
              "minLength": 1,
              "description": "The finding, in the words the station recorded it in - verbatim from the station's own fill line where the row came from a fills log."
            },
            "ref": {
              "type": "string",
              "minLength": 1,
              "description": "Where that finding is committed and can be re-read: a path in the stations ledger, a URL, a receipt id."
            },
            "tested_at": {
              "type": "string",
              "pattern": "^[0-9]{4}-[0-9]{2}-[0-9]{2}T[0-9]{2}:[0-9]{2}:[0-9]{2}Z$"
            },
            "subject_digest": {
              "type": "string",
              "pattern": "^sha256:[0-9a-f]{64}$",
              "description": "The image this evidence was produced against, when the evidence is image-specific. The verifier requires it to appear in this entry's `images[].index_digest` set - evidence collected against a digest this entry does not ship proves nothing about this entry."
            }
          }
        }
      },
      "station": {
        "type": "string",
        "minLength": 1,
        "description": "Which station made the claim. An unattributable proof is worse than none, for the same reason an unattributable verdict is."
      },
      "waived_by": {
        "type": "string",
        "minLength": 1,
        "description": "The human who accepted the value unproven. Required on a `waived` row and meaningless on a `proven` one."
      }
    },
    "allOf": [
      {
        "if": {
          "properties": { "verdict": { "const": "proven" } },
          "required": ["verdict"]
        },
        "then": {
          "required": ["evidence"],
          "properties": { "evidence": { "minItems": 1 } }
        }
      },
      {
        "if": {
          "properties": { "verdict": { "const": "waived" } },
          "required": ["verdict"]
        },
        "then": { "required": ["waived_by"] }
      }
    ]
  }
}
